Caption,Element
expenses for sewage disposal,acfr:ExpensesForSewageDisposal
expenses for soil conservation,acfr:ExpensesForSoilConservation
expenses for special assessments,acfr:ExpensesForSpecialAssessments
expenses for special election reimbursement,acfr:ExpensesForSpecialElectionReimbursement
expenses for state health benefit plan,acfr:ExpensesForStateHealthBenefitPlan
expenses for state institutions,acfr:ExpensesForStateInstitutions
expenses for storm sewer services,acfr:ExpensesForStormSewerServices
expenses for streets and highways,acfr:ExpensesForStreetsAndHighways
expenses for student grants and scholarships,acfr:ExpensesForStudentGrantsAndScholarships
expenses for student service,acfr:ExpensesForStudentService
expenses for survey and remonumentation,acfr:ExpensesForSurveyAndRemonumentation
expenses for telecommunications,acfr:ExpensesForTelecommunications
expenses for township properties,acfr:ExpensesForTownshipProperties
expenses for transportation services,acfr:ExpensesForTransportationServices
expenses for unemployment compensation,acfr:ExpensesForUnemploymentCompensation
expenses for utilities,acfr:ExpensesForUtilities
expenses for water and sewer systems,acfr:ExpensesForWaterAndSewerSystems
expenses for water supply services,acfr:ExpensesForWaterSupplyServices
expenses for watershed council,acfr:ExpensesForWatershedCouncil
expenses for welfare,acfr:ExpensesForWelfare
extraordinary items,acfr:ExtraordinaryItems
extraordinary items and special items,acfr:ExtraordinaryItemsAndSpecialItems
extraordinary items and special items modified accrual,acfr:ExtraordinaryItemsAndSpecialItemsModifiedAccrual
extraordinary items modified accrual,acfr:ExtraordinaryItemsModifiedAccrual
family counseling services member,acfr:FamilyCounselingServicesMember
family self suffciency escrows,acfr:FamilySelfSuffciencyEscrows
federal aid grants and contributions all other modified accrual,acfr:FederalAidGrantsAndContributionsAllOtherModifiedAccrual
federal aid grants and contributions c d b g modified accrual,acfr:FederalAidGrantsAndContributionsCDBGModifiedAccrual
federal aid grants and contributions culture and recreation modified accrual,acfr:FederalAidGrantsAndContributionsCultureAndRecreationModifiedAccrual
federal aid grants and contributions general government modified accrual,acfr:FederalAidGrantsAndContributionsGeneralGovernmentModifiedAccrual
federal aid grants and contributions health and hospital modified accrual,acfr:FederalAidGrantsAndContributionsHealthAndHospitalModifiedAccrual
federal aid grants and contributions public safety modified accrual,acfr:FederalAidGrantsAndContributionsPublicSafetyModifiedAccrual
federal aid grants and contributions sanitation modified accrual,acfr:FederalAidGrantsAndContributionsSanitationModifiedAccrual
federal aid grants and contributions welfare modified accrual,acfr:FederalAidGrantsAndContributionsWelfareModifiedAccrual
federal capital grants,acfr:FederalCapitalGrants
federal capital grants modified accrual,acfr:FederalCapitalGrantsModifiedAccrual
federal grants all other,acfr:FederalGrantsAllOther
federal grants community development block grants,acfr:FederalGrantsCommunityDevelopmentBlockGrants
federal grants culture and recreation,acfr:FederalGrantsCultureAndRecreation
federal grants general government,acfr:FederalGrantsGeneralGovernment
federal grants health and hospital,acfr:FederalGrantsHealthAndHospital
federal grants public safety,acfr:FederalGrantsPublicSafety
federal grants sanitation,acfr:FederalGrantsSanitation
federal grants welfare,acfr:FederalGrantsWelfare
fees modified accrual,acfr:FeesModifiedAccrual
fiduciary net position opeb,acfr:FiduciaryNetPositionOPEB
final budget member,acfr:FinalBudgetMember
financial aid expense,acfr:FinancialAidExpense
financial statement adc in compliance with numbered letter20183,acfr:FinancialStatementADCInComplianceWithNumberedLetter20183
fire defined benefit plan member,acfr:FireDefinedBenefitPlanMember
fire department member,acfr:FireDepartmentMember
fiscal end date,acfr:FiscalEndDate
fiscal month end,acfr:FiscalMonthEnd
fiscal start date,acfr:FiscalStartDate
fiscal year,acfr:FiscalYear
forfeiture certificate recording fees receivable,acfr:ForfeitureCertificateRecordingFeesReceivable
forfeiture certificate recording fees receivable modified accrual,acfr:ForfeitureCertificateRecordingFeesReceivableModifiedAccrual
form f65 michigan table,acfr:FormF65MichiganTable
friend of the court service fee modified accrual,acfr:FriendOfTheCourtServiceFeeModifiedAccrual
friend of the court statutory handling fee modified accrual,acfr:FriendOfTheCourtStatutoryHandlingFeeModifiedAccrual
fund balance,acfr:FundBalance
fund balance assigned,acfr:FundBalanceAssigned
fund balance assigned custom,acfr:FundBalanceAssignedCustom
fund balance assigned modified accrual description,acfr:FundBalanceAssignedModifiedAccrualDescription
fund balance committed,acfr:FundBalanceCommitted
fund balance committed custom,acfr:FundBalanceCommittedCustom
fund balance committed modified accrual description,acfr:FundBalanceCommittedModifiedAccrualDescription
fund balance line items,acfr:FundBalanceLineItems
fund balance nonspendable,acfr:FundBalanceNonspendable
fund balance nonspendable custom,acfr:FundBalanceNonspendableCustom
fund balance nonspendable inventory,acfr:FundBalanceNonspendableInventory
fund balance nonspendable long term advances to other funds,acfr:FundBalanceNonspendableLongTermAdvancesToOtherFunds
fund balance nonspendable modified accrual description,acfr:FundBalanceNonspendableModifiedAccrualDescription
fund balance nonspendable prepaids,acfr:FundBalanceNonspendablePrepaids
fund balance restricted,acfr:FundBalanceRestricted
fund balance restricted custom,acfr:FundBalanceRestrictedCustom
fund balance restricted modified accrual description,acfr:FundBalanceRestrictedModifiedAccrualDescription
fund balance unassigned,acfr:FundBalanceUnassigned
fund identifier axis,acfr:FundIdentifierAxis
fund name,acfr:FundName
fund type,acfr:FundType
funded ratio using uniform assumptions pension,acfr:FundedRatioUsingUniformAssumptionsPension
furniture and fixtures member,acfr:FurnitureAndFixturesMember
gain loss on sale of capital assets,acfr:GainLossOnSaleOfCapitalAssets
garnishments payable,acfr:GarnishmentsPayable
garnishments payable modified accrual,acfr:GarnishmentsPayableModifiedAccrual
general employees defined benefit plan member,acfr:GeneralEmployeesDefinedBenefitPlanMember
general fund member,acfr:GeneralFundMember
general government member,acfr:GeneralGovernmentMember
general obligation bonds,acfr:GeneralObligationBonds
general obligation bonds payable due in more than one year,acfr:GeneralObligationBondsPayableDueInMoreThanOneYear
general obligation bonds payable due within one year,acfr:GeneralObligationBondsPayableDueWithinOneYear
general obligation bonds roll forward,acfr:GeneralObligationBondsRollForward
general revenues and transfers,acfr:GeneralRevenuesAndTransfers
general revenues custom,acfr:GeneralRevenuesCustom
general revenues net,acfr:GeneralRevenuesNet
gifts,acfr:Gifts
golf courses member,acfr:GolfCoursesMember
gov bal sheet line items,acfr:GovBalSheetLineItems
gov bal sheet table,acfr:GovBalSheetTable
gov funds revenues table,acfr:GovFundsRevenuesTable
government claims receivable,acfr:GovernmentClaimsReceivable
government claims receivable allowance,acfr:GovernmentClaimsReceivableAllowance
government claims receivable net of allowance,acfr:GovernmentClaimsReceivableNetOfAllowance
government function axis,acfr:GovernmentFunctionAxis
government function domain,acfr:GovernmentFunctionDomain
government services and activities domain,acfr:GovernmentServicesAndActivitiesDomain
governmental activities member,acfr:GovernmentalActivitiesMember
governmental funds axis,acfr:GovernmentalFundsAxis
governmental funds domain,acfr:GovernmentalFundsDomain
governmental funds member,acfr:GovernmentalFundsMember
governmental funds statement of revenues line items,acfr:GovernmentalFundsStatementOfRevenuesLineItems
grand jury member,acfr:GrandJuryMember
grant related expenses,acfr:GrantRelatedExpenses
grants and contracts receivable,acfr:GrantsAndContractsReceivable
grants and contracts receivable allowance,acfr:GrantsAndContractsReceivableAllowance
grants and contracts receivable current modified accrual,acfr:GrantsAndContractsReceivableCurrentModifiedAccrual
grants and contracts receivable current net of allowance modified accrual,acfr:GrantsAndContractsReceivableCurrentNetOfAllowanceModifiedAccrual
grants and contracts receivable modified accrual,acfr:GrantsAndContractsReceivableModifiedAccrual
grants and contracts receivable net of allowance,acfr:GrantsAndContractsReceivableNetOfAllowance
grants and contracts receivable net of allowance modified accrual,acfr:GrantsAndContractsReceivableNetOfAllowanceModifiedAccrual
grants and contracts receivable net of allowance noncurrent,acfr:GrantsAndContractsReceivableNetOfAllowanceNoncurrent
grants and contracts receivable noncurrent,acfr:GrantsAndContractsReceivableNoncurrent
grants and contracts receivable noncurrent modified accrual,acfr:GrantsAndContractsReceivableNoncurrentModifiedAccrual
grants and contracts receivable noncurrent net of allowance modified accrual,acfr:GrantsAndContractsReceivableNoncurrentNetOfAllowanceModifiedAccrual
grants contributions and donations from federal governmental entities,acfr:GrantsContributionsAndDonationsFromFederalGovernmentalEntities
grants contributions and donations from federal governmental entities modified accrual,acfr:GrantsContributionsAndDonationsFromFederalGovernmentalEntitiesModifiedAccrual
grants contributions and donations from local units,acfr:GrantsContributionsAndDonationsFromLocalUnits
grants contributions and donations from others,acfr:GrantsContributionsAndDonationsFromOthers
grants contributions and donations from others modified accrual,acfr:GrantsContributionsAndDonationsFromOthersModifiedAccrual
grants contributions and donations from state governmental entities,acfr:GrantsContributionsAndDonationsFromStateGovernmentalEntities
grants contributions and donations from state governmental entities modified accrual,acfr:GrantsContributionsAndDonationsFromStateGovernmentalEntitiesModifiedAccrual
grants payable,acfr:GrantsPayable
grants payable modified accrual,acfr:GrantsPayableModifiedAccrual
guardian ad litem reimbursement modified accrual,acfr:GuardianAdLitemReimbursementModifiedAccrual
harbor services member,acfr:HarborServicesMember
health and welfare member,acfr:HealthAndWelfareMember
health departments clinics services member,acfr:HealthDepartmentsClinicsServicesMember
health services expense,acfr:HealthServicesExpense
healthcare system triggers underfunded status flag,acfr:HealthcareSystemTriggersUnderfundedStatusFlag
hospitals member,acfr:HospitalsMember
housing assistance payments expense,acfr:HousingAssistancePaymentsExpense
human services medical care member,acfr:HumanServicesMedicalCareMember
improvements other than building member,acfr:ImprovementsOtherThanBuildingMember
improvements other than buildings,acfr:ImprovementsOtherThanBuildings
income loss before capital contributions,acfr:IncomeLossBeforeCapitalContributions
income tax receivable,acfr:IncomeTaxReceivable
income tax receivable modified accrual,acfr:IncomeTaxReceivableModifiedAccrual
income tax revenue from non residents,acfr:IncomeTaxRevenueFromNonResidents
income tax revenue from residents,acfr:IncomeTaxRevenueFromResidents
income taxes receivable net of allowance modified accrual,acfr:IncomeTaxesReceivableNetOfAllowanceModifiedAccrual
increase decrease in accounts payable,acfr:IncreaseDecreaseInAccountsPayable
increase decrease in accounts receivable,acfr:IncreaseDecreaseInAccountsReceivable
increase decrease in accrued interest payable,acfr:IncreaseDecreaseInAccruedInterestPayable
increase decrease in accrued liabilities,acfr:IncreaseDecreaseInAccruedLiabilities
increase decrease in claims payable,acfr:IncreaseDecreaseInClaimsPayable
increase decrease in compensated absences payable,acfr:IncreaseDecreaseInCompensatedAbsencesPayable
increase decrease in customer deposits payable,acfr:IncreaseDecreaseInCustomerDepositsPayable
increase decrease in deferred inflows,acfr:IncreaseDecreaseInDeferredInflows
increase decrease in deferred inflows opeb,acfr:IncreaseDecreaseInDeferredInflowsOPEB
increase decrease in deferred inflows pension,acfr:IncreaseDecreaseInDeferredInflowsPension
increase decrease in deferred outflows,acfr:IncreaseDecreaseInDeferredOutflows
increase decrease in deferred outflows opeb,acfr:IncreaseDecreaseInDeferredOutflowsOPEB
increase decrease in deferred outflows pension,acfr:IncreaseDecreaseInDeferredOutflowsPension
increase decrease in deposits,acfr:IncreaseDecreaseInDeposits
increase decrease in depreciation,acfr:IncreaseDecreaseInDepreciation
increase decrease in due from other funds,acfr:IncreaseDecreaseInDueFromOtherFunds
increase decrease in due from other governments,acfr:IncreaseDecreaseInDueFromOtherGovernments
increase decrease in due to other funds,acfr:IncreaseDecreaseInDueToOtherFunds
increase decrease in due to other governments,acfr:IncreaseDecreaseInDueToOtherGovernments
increase decrease in inventory,acfr:IncreaseDecreaseInInventory
increase decrease in net pension liability,acfr:IncreaseDecreaseInNetPensionLiability
increase decrease in opeb liability,acfr:IncreaseDecreaseInOPEBLiability
increase decrease in operating assets and liabilities,acfr:IncreaseDecreaseInOperatingAssetsAndLiabilities
increase decrease in other assets custom,acfr:IncreaseDecreaseInOtherAssetsCustom
increase decrease in other deferred inflows custom,acfr:IncreaseDecreaseInOtherDeferredInflowsCustom
increase decrease in other deferred outflows custom,acfr:IncreaseDecreaseInOtherDeferredOutflowsCustom
increase decrease in other liabilities custom,acfr:IncreaseDecreaseInOtherLiabilitiesCustom
increase decrease in prepaids,acfr:IncreaseDecreaseInPrepaids
increase decrease in right to use asset,acfr:IncreaseDecreaseInRightToUseAsset
increase decrease in special assessments receivable,acfr:IncreaseDecreaseInSpecialAssessmentsReceivable
infrastructure,acfr:Infrastructure
infrastructure member,acfr:InfrastructureMember
inside millage,acfr:InsideMillage
installment debt,acfr:InstallmentDebt
installment debt payable due in more than one year,acfr:InstallmentDebtPayableDueInMoreThanOneYear
installment debt principal due within one year,acfr:InstallmentDebtPrincipalDueWithinOneYear
installment debt roll forward,acfr:InstallmentDebtRollForward
installment receivable noncurrent,acfr:InstallmentReceivableNoncurrent
insurance expense,acfr:InsuranceExpense
intangible assets,acfr:IntangibleAssets
intangible assets member,acfr:IntangibleAssetsMember
intangible assets net of accumulated amortization,acfr:IntangibleAssetsNetOfAccumulatedAmortization
inter governmental payable modified accrual,acfr:InterGovernmentalPayableModifiedAccrual
inter governmental receivable,acfr:InterGovernmentalReceivable
inter governmental receivable allowance,acfr:InterGovernmentalReceivableAllowance
inter governmental receivable current modified accrual,acfr:InterGovernmentalReceivableCurrentModifiedAccrual
inter governmental receivable current net of allowance modified accrual,acfr:InterGovernmentalReceivableCurrentNetOfAllowanceModifiedAccrual
inter governmental receivable modified accrual,acfr:InterGovernmentalReceivableModifiedAccrual
inter governmental receivable net of allowance,acfr:InterGovernmentalReceivableNetOfAllowance
inter governmental receivable net of allowance modified accrual,acfr:InterGovernmentalReceivableNetOfAllowanceModifiedAccrual
inter governmental receivable noncurrent modified accrual,acfr:InterGovernmentalReceivableNoncurrentModifiedAccrual
inter governmental receivable noncurrent net of allowance modified accrual,acfr:InterGovernmentalReceivableNoncurrentNetOfAllowanceModifiedAccrual
interest and penalties for tax fund,acfr:InterestAndPenaltiesForTaxFund
interest and penalties receivable on taxes,acfr:InterestAndPenaltiesReceivableOnTaxes
interest and penalties receivable on taxes modified accrual,acfr:InterestAndPenaltiesReceivableOnTaxesModifiedAccrual
interest expense,acfr:InterestExpense
interest expense imputed on annuitized prize liability,acfr:InterestExpenseImputedOnAnnuitizedPrizeLiability
interest paid all other debt,acfr:InterestPaidAllOtherDebt
interest paid electric power system debt,acfr:InterestPaidElectricPowerSystemDebt
interest paid sewer system debt,acfr:InterestPaidSewerSystemDebt
interest paid transit system debt,acfr:InterestPaidTransitSystemDebt
interest paid water supply system debt,acfr:InterestPaidWaterSupplySystemDebt
interest receivable,acfr:AccruedInterestReceivable
interest receivable allowances,acfr:InterestReceivableAllowances
intergovernmental agreement payable,acfr:IntergovernmentalAgreementPayable
intergovernmental agreement payable due in more than one year,acfr:IntergovernmentalAgreementPayableDueInMoreThanOneYear
intergovernmental agreement payable principal due within one year,acfr:IntergovernmentalAgreementPayablePrincipalDueWithinOneYear
intergovernmental revenue from state all other modified accrual,acfr:IntergovernmentalRevenueFromStateAllOtherModifiedAccrual
intergovernmental revenue from state court of equity modified accrual,acfr:IntergovernmentalRevenueFromStateCourtOfEquityModifiedAccrual
intergovernmental revenue from state crime victims rights modified accrual,acfr:IntergovernmentalRevenueFromStateCrimeVictimsRightsModifiedAccrual
intergovernmental revenue from state culture and recreation modified accrual,acfr:IntergovernmentalRevenueFromStateCultureAndRecreationModifiedAccrual
intergovernmental revenue from state drug case information management modified accrual,acfr:IntergovernmentalRevenueFromStateDrugCaseInformationManagementModifiedAccrual
intergovernmental revenue from state drunk driving case flow assistance modified accrual,acfr:IntergovernmentalRevenueFromStateDrunkDrivingCaseFlowAssistanceModifiedAccrual
intergovernmental revenue from state health and hospitals modified accrual,acfr:IntergovernmentalRevenueFromStateHealthAndHospitalsModifiedAccrual
intergovernmental revenue from state indigent defense modified accrual,acfr:IntergovernmentalRevenueFromStateIndigentDefenseModifiedAccrual
intergovernmental revenue from state public safety modified accrual,acfr:IntergovernmentalRevenueFromStatePublicSafetyModifiedAccrual
intergovernmental revenue from state sanitation modified accrual,acfr:IntergovernmentalRevenueFromStateSanitationModifiedAccrual
intergovernmental revenue from state special election reimbursement modified accrual,acfr:IntergovernmentalRevenueFromStateSpecialElectionReimbursementModifiedAccrual
intergovernmental revenue from state state revenue sharing modified accrual,acfr:IntergovernmentalRevenueFromStateStateRevenueSharingModifiedAccrual
intergovernmental revenue from state streets and highways modified accrual,acfr:IntergovernmentalRevenueFromStateStreetsAndHighwaysModifiedAccrual
intergovernmental revenue from state survey and remonumentation modified accrual,acfr:IntergovernmentalRevenueFromStateSurveyAndRemonumentationModifiedAccrual
intergovernmental revenue from state welfare modified accrual,acfr:IntergovernmentalRevenueFromStateWelfareModifiedAccrual
internal balance,acfr:InternalBalance
internal balances,acfr:InternalBalance
internal balances payable,acfr:InternalBalancesPayable
internal service funds member,acfr:InternalServiceFundsMember
internal transfers,acfr:InternalTransfers
inventory,acfr:Inventory
inventory and prepaid items modified accrual,acfr:InventoryAndPrepaidItemsModifiedAccrual
inventory equipment materials and parts,acfr:InventoryEquipmentMaterialsAndParts
inventory equipment materials and parts modified accrual,acfr:InventoryEquipmentMaterialsAndPartsModifiedAccrual
inventory modified accrual,acfr:InventoryModifiedAccrual
inventory non current,acfr:InventoryNonCurrent
inventory road materials,acfr:InventoryRoadMaterials
inventory road materials modified accrual,acfr:InventoryRoadMaterialsModifiedAccrual
investment gains losses,acfr:InvestmentGainsLosses
investment gains losses modified accrual,acfr:InvestmentGainsLossesModifiedAccrual
investment in affordable housing,acfr:OtherNoncurrentAssets
investment in affordable housing modfied accrual,acfr:OtherCurrentAssetsModifiedAccrual
investment in capital assets modified accrual,acfr:InvestmentInCapitalAssetsModifiedAccrual
investment income,acfr:InvestmentIncome
investment income and rentals,acfr:InvestmentIncomeAndRentals
investment income and rentals modified accrual,acfr:InvestmentIncomeAndRentalsModifiedAccrual
investment income modified accrual,acfr:InvestmentIncomeModifiedAccrual
investment income receivable modified accrual,acfr:InvestmentIncomeReceivableModifiedAccrual
investment income receivable net of allowance modified accrual,acfr:InvestmentIncomeReceivableNetOfAllowanceModifiedAccrual
investments abtract,acfr:InvestmentsAbtract
investments current,acfr:InvestmentsCurrent
investments endowment,acfr:InvestmentsEndowment
investments held by third parties,acfr:InvestmentsHeldByThirdParties
investments in associates,acfr:InvestmentsInAssociates
investments in joint ventures,acfr:InvestmentsInJointVentures
investments in joint ventures modified accrual,acfr:InvestmentsInJointVenturesModifiedAccrual
investments in subsidiaries,acfr:InvestmentsInSubsidiaries
investments modified accrual,acfr:InvestmentsModifiedAccrual
investments of surplus funds,acfr:InvestmentsOfSurplusFunds
investments of surplus funds modified accrual,acfr:InvestmentsOfSurplusFundsModifiedAccrual
investments restricted,acfr:InvestmentsRestricted
investments with fiscal agents,acfr:InvestmentsWithFiscalAgents
investments with fiscal agents modified accrual,acfr:InvestmentsWithFiscalAgentsModifiedAccrual
investments with state treasury,acfr:InvestmentsWithStateTreasury
investments with state treasury modified accrual,acfr:InvestmentsWithStateTreasuryModifiedAccrual
issuance cost and amortization of bond discount,acfr:IssuanceCostAndAmortizationOfBondDiscount
issuer axis,acfr:IssuerAxis
judicial activities member,acfr:JudicialActivitiesMember
jury demand fees modified accrual,acfr:JuryDemandFeesModifiedAccrual
land,acfr:Land
land and construction in progress,acfr:LandAndConstructionInProgress
land and construction in progress member,acfr:LandAndConstructionInProgressMember
land and improvements,acfr:LandAndImprovements
land and improvements member,acfr:LandAndImprovementsMember
land construction in progress and other non depreciable assets,acfr:LandConstructionInProgressAndOtherNonDepreciableAssets
land contracts payable,acfr:LandContractsPayable
land contracts payable modified accrual,acfr:LandContractsPayableModifiedAccrual
land contracts receivable,acfr:LandContractsReceivable
land contracts receivable current modified accrual,acfr:LandContractsReceivableCurrentModifiedAccrual
land contracts receivable modified accrual,acfr:LandContractsReceivableModifiedAccrual
land contracts receivable noncurrent modified accrual,acfr:LandContractsReceivableNoncurrentModifiedAccrual
land contracts receivables allowance,acfr:LandContractsReceivablesAllowance
land contracts receivables allowance modified accrual,acfr:LandContractsReceivablesAllowanceModifiedAccrual
land contracts receivables current allowance modified accrual,acfr:LandContractsReceivablesCurrentAllowanceModifiedAccrual
land contracts receivables current net of allowance modified accrual,acfr:LandContractsReceivablesCurrentNetOfAllowanceModifiedAccrual
land contracts receivables net of allowance,acfr:LandContractsReceivablesNetOfAllowance
land contracts receivables net of allowance modified accrual,acfr:LandContractsReceivablesNetOfAllowanceModifiedAccrual
land contracts receivables noncurrent allowance modified accrual,acfr:LandContractsReceivablesNoncurrentAllowanceModifiedAccrual
land contracts receivables noncurrent net of allowance modified accrual,acfr:LandContractsReceivablesNoncurrentNetOfAllowanceModifiedAccrual
land held for resale,acfr:LandHeldForResale
land improvements depreciating,acfr:LandImprovementsDepreciating
land improvements member,acfr:LandImprovementsMember
land improvements non depreciating,acfr:LandImprovementsNonDepreciating
land member,acfr:LandMember
landfill member,acfr:LandfillMember
law library member,acfr:LawLibraryMember
lease assets right of use,acfr:LeaseAssetsRightOfUse
lease assets right of use member,acfr:LeaseAssetsRightOfUseMember
lease assets right of use modified accrual,acfr:LeaseAssetsRightOfUseModifiedAccrual
lease assets right of use net of accumulated amortization,acfr:LeaseAssetsRightOfUseNetOfAccumulatedAmortization
lease investment income,acfr:LeaseInvestmentIncome
lease investment income modified accrual,acfr:LeaseInvestmentIncomeModifiedAccrual
lease payable,acfr:LeasesPayable
lease receivable net noncurrent modified accrual,acfr:LeaseReceivableNetNoncurrentModifiedAccrual
leasehold improvements,acfr:LeaseholdImprovements
leasehold improvements member,acfr:LeaseholdImprovementsMember
leases accumulated amortization,acfr:LeasesAccumulatedAmortization
leases accumulated amortization modified accrual,acfr:LeasesAccumulatedAmortizationModifiedAccrual
leases payable,acfr:LeasesPayable
leases payable current modified accrual,acfr:LeasesPayableCurrentModifiedAccrual
leases payable due in more than one year,acfr:LeasesPayableDueInMoreThanOneYear
leases payable due in more than one year modified accrual,acfr:LeasesPayableDueInMoreThanOneYearModifiedAccrual
leases payable due within one year,acfr:LeasesPayableDueWithinOneYear
