Caption,Element
deferred inflows of resources special assessments modified accrual,acfr:DeferredInflowsOfResourcesSpecialAssessmentsModifiedAccrual
deferred inflows of resources taxes levied for a subsequent period,acfr:DeferredInflowsOfResourcesTaxesLeviedForASubsequentPeriod
deferred inflows of resources taxes levied for a subsequent period modified accrual,acfr:DeferredInflowsOfResourcesTaxesLeviedForASubsequentPeriodModifiedAccrual
deferred inflows of resources unavailable revenue modified accrual,acfr:DeferredInflowsOfResourcesUnavailableRevenueModifiedAccrual
deferred inflows related to opeb,acfr:DeferredInflowsOfResourcesOPEB
deferred inflows related to pension,acfr:DeferredInflowsOfResourcesPension
deferred inflowsof resources opeb difference expected and actual,acfr:DeferredInflowsofResourcesOPEBDifferenceExpectedAndActual
deferred inflowsof resources opeb net dif projected and actual earnings pension plan investments,acfr:DeferredInflowsofResourcesOPEBNetDifProjectedAndActualEarningsPensionPlanInvestments
deferred inflowsof resources pension difference expected and actual,acfr:DeferredInflowsofResourcesPensionDifferenceExpectedAndActual
deferred inflowsof resources pension net dif projected and actual earnings pension plan investments,acfr:DeferredInflowsofResourcesPensionNetDifProjectedAndActualEarningsPensionPlanInvestments
deferred outflows from opeb changes in proportion,acfr:DeferredOutflowsFromOPEBChangesInProportion
deferred outflows from pension changes in proportion,acfr:DeferredOutflowsFromPensionChangesInProportion
deferred outflows of resources,acfr:DeferredOutflowsOfResources
deferred outflows of resources custom,acfr:DeferredOutflowsOfResourcesCustom
deferred outflows of resources custom modified accrual,acfr:DeferredOutflowsOfResourcesCustomModifiedAccrual
deferred outflows of resources debt,acfr:DeferredOutflowsOfResourcesDebt
deferred outflows of resources modified accrual,acfr:DeferredOutflowsOfResourcesModifiedAccrual
deferred outflows of resources opeb,acfr:DeferredOutflowsOfResourcesOPEB
deferred outflows of resources opeb changes in assumptions,acfr:DeferredOutflowsOfResourcesOPEBChangesInAssumptions
deferred outflows of resources opeb contributions made after measurement date,acfr:DeferredOutflowsOfResourcesOPEBContributionsMadeAfterMeasurementDate
deferred outflows of resources opeb net dif projected and actual earnings pension plan investments,acfr:DeferredOutflowsOfResourcesOPEBNetDifProjectedAndActualEarningsPensionPlanInvestments
deferred outflows of resources other,acfr:DeferredOutflowsOfResourcesOther
deferred outflows of resources pension,acfr:DeferredOutflowsOfResourcesPension
deferred outflows of resources pension changes in assumptions,acfr:DeferredOutflowsOfResourcesPensionChangesInAssumptions
deferred outflows of resources pension contributions made after measurement date,acfr:DeferredOutflowsOfResourcesPensionContributionsMadeAfterMeasurementDate
deferred outflows of resources pension net dif projected and actual earnings pension plan investments,acfr:DeferredOutflowsOfResourcesPensionNetDifProjectedAndActualEarningsPensionPlanInvestments
deferred outflows of resources state university retirement system,acfr:DeferredOutflowsOfResourcesStateUniversityRetirementSystem
deferred outflows related to opeb,acfr:DeferredOutflowsOfResourcesOPEB
deferred outflows related to pension,acfr:DeferredOutflowsOfResourcesPension
deferred outflowsof resources opeb difference expected and actual,acfr:DeferredOutflowsofResourcesOPEBDifferenceExpectedAndActual
deferred outflowsof resources pension difference expected and actual,acfr:DeferredOutflowsofResourcesPensionDifferenceExpectedAndActual
deferred revenue,acfr:DeferredRevenue
defined benefit pension plans audited flag,acfr:DefinedBenefitPensionPlansAuditedFlag
defined benefit plan axis,acfr:DefinedBenefitPlanAxis
defined benefit plan domain,acfr:DefinedBenefitPlanDomain
defined benefit plan type primary government fire,acfr:DefinedBenefitPlanTypePrimaryGovernmentFire
defined benefit plan type primary government general employees,acfr:DefinedBenefitPlanTypePrimaryGovernmentGeneralEmployees
defined benefit plan type primary government other,acfr:DefinedBenefitPlanTypePrimaryGovernmentOther
defined benefit plan type primary government police,acfr:DefinedBenefitPlanTypePrimaryGovernmentPolice
defined benefit plan type primary government police and fire or public safety,acfr:DefinedBenefitPlanTypePrimaryGovernmentPoliceAndFireOrPublicSafety
delinquent taxes receivable,acfr:DelinquentTaxesReceivable
delinquent taxes receivable modified accrual,acfr:DelinquentTaxesReceivableModifiedAccrual
delinquent taxes receivable noncurrent,acfr:DelinquentTaxesReceivableNoncurrent
delinquent utility bills receivable,acfr:DelinquentUtilityBillsReceivable
delinquent utility bills receivable modified accrual,acfr:DelinquentUtilityBillsReceivableModifiedAccrual
depletable assets,acfr:DepletableAssets
depletable assets member,acfr:DepletableAssetsMember
depletion depreciation and amortization expense,acfr:DepletionDepreciationAndAmortizationExpense
deposits held for others modified accrual,acfr:DepositsHeldForOthersModifiedAccrual
deposits heldfor others,acfr:DepositsHeldforOthers
deposits payable,acfr:DepositsHeldforOthers
deposits receivable,acfr:DepositsReceivable
deposits receivable allowance,acfr:DepositsReceivableAllowance
deposits receivable modified accrual,acfr:DepositsReceivableModifiedAccrual
deposits receivable net of allowance,acfr:DepositsReceivableNetOfAllowance
deposits receivable net of allowance modified accrual,acfr:DepositsReceivableNetOfAllowanceModifiedAccrual
deposits with fiscal agents,acfr:DepositsWithFiscalAgents
deposits with fiscal agents modified accrual,acfr:DepositsWithFiscalAgentsModifiedAccrual
depreciable assets net,acfr:CapitalAssetsBeingDepreciatedNet
depreciation expense,acfr:DepreciationExpense
depreciation expense modified accrual,acfr:DepreciationExpenseModifiedAccrual
depreciation unallocated,acfr:DepreciationUnallocated
derivative instruments assets current,acfr:DerivativeInstrumentsAssetsCurrent
derivative instruments assets modified accrual,acfr:DerivativeInstrumentsAssetsModifiedAccrual
derivative instruments assets non current,acfr:DerivativeInstrumentsAssetsNonCurrent
derivative instruments liability current,acfr:DerivativeInstrumentsLiabilityCurrent
derivative instruments liability current modified accrual,acfr:DerivativeInstrumentsLiabilityCurrentModifiedAccrual
derivative instruments liability modified accrual,acfr:DerivativeInstrumentsLiabilityModifiedAccrual
derivative instruments liability non current,acfr:DerivativeInstrumentsLiabilityNonCurrent
derivative instruments liability noncurrent modified accrual,acfr:DerivativeInstrumentsLiabilityNoncurrentModifiedAccrual
derivative type,acfr:DerivativeType
derivatives cost,acfr:DerivativesCost
derivatives line items,acfr:DerivativesLineItems
derivatives market value,acfr:DerivativesMarketValue
differences between expected and actual experience in measurement of total pension liability,acfr:DifferencesBetweenExpectedAndActualExperienceInMeasurementOfTotalPensionLiability
disaggregation line item axis,acfr:DisaggregationLineItemAxis
disbursements of loan funds to students,acfr:DisbursementsOfLoanFundsToStudents
discounts on bonds or notes,acfr:DiscountsOnBondsOrNotes
discounts on bonds or notes modified accrual,acfr:DiscountsOnBondsOrNotesModifiedAccrual
district and municipal court member,acfr:DistrictAndMunicipalCourtMember
division closed to new employees flag opeb,acfr:DivisionClosedToNewEmployeesFlagOPEB
division closed to new employees flag pension,acfr:DivisionClosedToNewEmployeesFlagPension
do all investments comply with p. a.20 of1943,acfr:DoAllInvestmentsComplyWithP.A.20Of1943
document title,acfr:DocumentTitle
does the investment policy allow mutual funds with net asset values other than1,acfr:DoesTheInvestmentPolicyAllowMutualFundsWithNetAssetValuesOtherThan1
does the unit have an investment policy approved by the governing body that complies with g a s b statement no.40,acfr:DoesTheUnitHaveAnInvestmentPolicyApprovedByTheGoverningBodyThatCompliesWithGASBStatementNo.40
drain orders payable,acfr:DrainOrdersPayable
drain orders payable modified accrual,acfr:DrainOrdersPayableModifiedAccrual
due from cities,acfr:DueFromCities
due from cities modified accrual,acfr:DueFromCitiesModifiedAccrual
due from component unit,acfr:DueFromComponentUnit
due from component unit modified accrual,acfr:DueFromComponentUnitModifiedAccrual
due from component unit noncurrent,acfr:DueFromComponentUnitNoncurrent
due from counties,acfr:DueFromCounties
due from counties modified accrual,acfr:DueFromCountiesModifiedAccrual
due from custodial funds,acfr:DueFromCustodialFunds
due from employees,acfr:DueFromEmployees
due from employees modified accrual,acfr:DueFromEmployeesModifiedAccrual
due from enterprise funds,acfr:DueFromEnterpriseFunds
due from enterprise funds modified accrual,acfr:DueFromEnterpriseFundsModifiedAccrual
due from federal government,acfr:DueFromFederalGovernment
due from federal government modified accrual,acfr:DueFromFederalGovernmentModifiedAccrual
due from federal government noncurrent,acfr:DueFromFederalGovernmentNoncurrent
due from fiduciary funds,acfr:DueFromFiduciaryFunds
due from fiduciary funds modified accrual,acfr:DueFromFiduciaryFundsModifiedAccrual
due from government,acfr:DueFromGovernment
due from libraries,acfr:DueFromLibraries
due from libraries modified accrual,acfr:DueFromLibrariesModifiedAccrual
due from local government units,acfr:DueFromLocalGovernmentUnits
due from other funds,acfr:DueFromOtherFunds
due from other funds modified accrual,acfr:DueFromOtherFundsModifiedAccrual
due from other government modified accrual,acfr:DueFromOtherGovernmentModifiedAccrual
due from other governments,acfr:DueFromOtherGovernments
due from other governments and units modified accrual,acfr:DueFromOtherGovernmentsAndUnitsModifiedAccrual
due from other governments noncurrent,acfr:DueFromOtherGovernmentsNoncurrent
due from others modified accrual,acfr:DueFromOthersModifiedAccrual
due from primary government,acfr:DueFromPrimaryGovernment
due from related parties,acfr:DueFromRelatedParties
due from retirement system,acfr:DueFromRetirementSystem
due from road commissions,acfr:DueFromRoadCommissions
due from road commissions modified accrual,acfr:DueFromRoadCommissionsModifiedAccrual
due from schools,acfr:DueFromSchools
due from schools modified accrual,acfr:DueFromSchoolsModifiedAccrual
due from state government,acfr:DueFromStateGovernment
due from state government modified accrual,acfr:DueFromStateGovernmentModifiedAccrual
due from state government noncurrent,acfr:DueFromStateGovernmentNoncurrent
due from tax collection funds,acfr:DueFromTaxCollectionFunds
due from townships except road agreements,acfr:DueFromTownshipsExceptRoadAgreements
due from townships except road agreements modified accrual,acfr:DueFromTownshipsExceptRoadAgreementsModifiedAccrual
due from townships road agreements,acfr:DueFromTownshipsRoadAgreements
due from townships road agreements modified accrual,acfr:DueFromTownshipsRoadAgreementsModifiedAccrual
due from villages,acfr:DueFromVillages
due from villages modified accrual,acfr:DueFromVillagesModifiedAccrual
due to cities,acfr:DueToCities
due to cities modified accrual,acfr:DueToCitiesModifiedAccrual
due to community college,acfr:DueToCommunityCollege
due to community college modified accrual,acfr:DueToCommunityCollegeModifiedAccrual
due to component unit,acfr:DueToComponentUnit
due to component unit modified accrual,acfr:DueToComponentUnitModifiedAccrual
due to counties,acfr:DueToCounties
due to counties modified accrual,acfr:DueToCountiesModifiedAccrual
due to court wards,acfr:DueToCourtWards
due to court wards modified accrual,acfr:DueToCourtWardsModifiedAccrual
due to education,acfr:DueToEducation
due to employees,acfr:DueToEmployees
due to employees modified accrual,acfr:DueToEmployeesModifiedAccrual
due to enterprise funds modified accrual,acfr:DueToEnterpriseFundsModifiedAccrual
due to federal government,acfr:DueToFederalGovernment
due to federal government modified accrual,acfr:DueToFederalGovernmentModifiedAccrual
due to fiduciary funds,acfr:DueToFiduciaryFunds
due to fiduciary funds modified accrual,acfr:DueToFiduciaryFundsModifiedAccrual
due to fiscal agent,acfr:DueToFiscalAgent
due to fiscal agent modified accrual,acfr:DueToFiscalAgentModifiedAccrual
due to former employees,acfr:DueToFormerEmployees
due to former employees modified accrual,acfr:DueToFormerEmployeesModifiedAccrual
due to general fund,acfr:DueToGeneralFund
due to intermediate school districts,acfr:DueToIntermediateSchoolDistricts
due to intermediate school districts modified accrual,acfr:DueToIntermediateSchoolDistrictsModifiedAccrual
due to libraries,acfr:DueToLibraries
due to libraries modified accrual,acfr:DueToLibrariesModifiedAccrual
due to other agencies payable from resticted assets,acfr:DueToOtherAgenciesPayableFromRestictedAssets
due to other funds,acfr:DueToOtherFunds
due to other funds modified accrual,acfr:DueToOtherFundsModifiedAccrual
due to other governments,acfr:DueToOtherGovernments
due to other governments modified accrual,acfr:DueToOtherGovernmentsModifiedAccrual
due to others,acfr:DueToOthers
due to others modified accrual,acfr:DueToOthersModifiedAccrual
due to primary government,acfr:DueToPrimaryGovernment
due to primary government modified accrual,acfr:DueToPrimaryGovernmentModifiedAccrual
due to proprietary funds,acfr:DueToProprietaryFunds
due to related parties,acfr:DueToRelatedParties
due to road commissions,acfr:DueToRoadCommissions
due to road commissions modified accrual,acfr:DueToRoadCommissionsModifiedAccrual
due to schools,acfr:DueToSchools
due to schools modified accrual,acfr:DueToSchoolsModifiedAccrual
due to special education,acfr:DueToSpecialEducation
due to special education modified accrual,acfr:DueToSpecialEducationModifiedAccrual
due to state due in more than one year,acfr:DueToStateDueInMoreThanOneYear
due to state government,acfr:DueToStateGovernment
due to state government modified accrual,acfr:DueToStateGovernmentModifiedAccrual
due to taxpayers tax overpayments and duplicate payments,acfr:DueToTaxpayersTaxOverpaymentsAndDuplicatePayments
due to taxpayers tax overpayments and duplicate payments modified accrual,acfr:DueToTaxpayersTaxOverpaymentsAndDuplicatePaymentsModifiedAccrual
due to townships,acfr:DueToTownships
due to townships modified accrual,acfr:DueToTownshipsModifiedAccrual
due to villages,acfr:DueToVillages
due to villages modified accrual,acfr:DueToVillagesModifiedAccrual
dup_1_ due to governments,acfr:Dup_1_DueToGovernments
dup_1_ investments held by third parties modified accrual,acfr:Dup_1_InvestmentsHeldByThirdPartiesModifiedAccrual
easements right of way,acfr:EasementsRightOfWay
easements right of way member,acfr:EasementsRightOfWayMember
economic development services member,acfr:EconomicDevelopmentServicesMember
electricity and power services member,acfr:ElectricityAndPowerServicesMember
emergency dispatch member,acfr:EmergencyDispatchMember
emergency services member,acfr:EmergencyServicesMember
employee retirement administered by financial institution,acfr:EmployeeRetirementAdministeredByFinancialInstitution
employee retirement administered by insurance company,acfr:EmployeeRetirementAdministeredByInsuranceCompany
employee retirement administered by m e r s,acfr:EmployeeRetirementAdministeredByMERS
employee retirement administered by self,acfr:EmployeeRetirementAdministeredBySelf
employee retirement system administered by,acfr:EmployeeRetirementSystemAdministeredBy
employee retirement system flag,acfr:EmployeeRetirementSystemFlag
employer contributions made defined contribution plans,acfr:EmployerContributionsMadeDefinedContributionPlans
employer identification number,acfr:EmployerIdentificationNumber
employers proportionate share of collective net opeb liability,acfr:EmployersProportionateShareOfCollectiveNetOPEBLiability
employers proportionate share of collective net pension liability,acfr:EmployersProportionateShareOfCollectiveNetPensionLiability
engineering equipment,acfr:EngineeringEquipment
engineering equipment member,acfr:EngineeringEquipmentMember
environmental and disposal liabilities,acfr:EnvironmentalAndDisposalLiabilities
equipment,acfr:Equipment
equipment member,acfr:EquipmentMember
escrow deposits,acfr:EscrowDeposits
estate inventory fee modified accrual,acfr:EstateInventoryFeeModifiedAccrual
estimated liability for landfill post closure care costs,acfr:EstimatedLiabilityForLandfillPostClosureCareCosts
excess deficiency of revenues over under expenditures,acfr:ExcessDeficiencyOfRevenuesOverUnderExpenditures
expenditures and other financing uses modified accrual,acfr:ExpendituresAndOtherFinancingUsesModifiedAccrual
expenditures custom modified accrual,acfr:ExpendituresCustomModifiedAccrual
expenditures for airport services modified accrual,acfr:ExpendituresForAirportServicesModifiedAccrual
expenditures for all other public safety activities modified accrual,acfr:ExpendituresForAllOtherPublicSafetyActivitiesModifiedAccrual
expenditures for all other public works enterprise activities modified accrual,acfr:ExpendituresForAllOtherPublicWorksEnterpriseActivitiesModifiedAccrual
expenditures for all other public works modified accrual,acfr:ExpendituresForAllOtherPublicWorksModifiedAccrual
expenditures for all other recreation and culture modified accrual,acfr:ExpendituresForAllOtherRecreationAndCultureModifiedAccrual
expenditures for all redevelopment and housing programs modified accrual,acfr:ExpendituresForAllRedevelopmentAndHousingProgramsModifiedAccrual
expenditures for assessing equalization modified accrual,acfr:ExpendituresForAssessingEqualizationModifiedAccrual
expenditures for capital outlay modified accrual,acfr:ExpendituresForCapitalOutlayModifiedAccrual
expenditures for chief executive administrator manager superintendent controller modified accrual,acfr:ExpendituresForChiefExecutiveAdministratorManagerSuperintendentControllerModifiedAccrual
expenditures for chief executive organization unit modified accrual,acfr:ExpendituresForChiefExecutiveOrganizationUnitModifiedAccrual
expenditures for child care activities department of human services modified accrual,acfr:ExpendituresForChildCareActivitiesDepartmentOfHumanServicesModifiedAccrual
expenditures for clerk modified accrual,acfr:ExpendituresForClerkModifiedAccrual
expenditures for communications dispatch modified accrual,acfr:ExpendituresForCommunicationsDispatchModifiedAccrual
expenditures for communications modified accrual,acfr:ExpendituresForCommunicationsModifiedAccrual
expenditures for community and economic development services modified accrual,acfr:ExpendituresForCommunityAndEconomicDevelopmentServicesModifiedAccrual
expenditures for community economic development abstract department modified accrual,acfr:ExpendituresForCommunityEconomicDevelopmentAbstractDepartmentModifiedAccrual
expenditures for community economic development blight removal modified accrual,acfr:ExpendituresForCommunityEconomicDevelopmentBlightRemovalModifiedAccrual
expenditures for community economic development cooperative extension modified accrual,acfr:ExpendituresForCommunityEconomicDevelopmentCooperativeExtensionModifiedAccrual
expenditures for community economic development home demolition modified accrual,acfr:ExpendituresForCommunityEconomicDevelopmentHomeDemolitionModifiedAccrual
expenditures for community economic development home renovation modified accrual,acfr:ExpendituresForCommunityEconomicDevelopmentHomeRenovationModifiedAccrual
expenditures for community economic development planning and zoning modified accrual,acfr:ExpendituresForCommunityEconomicDevelopmentPlanningAndZoningModifiedAccrual
expenditures for community economic development planning modified accrual,acfr:ExpendituresForCommunityEconomicDevelopmentPlanningModifiedAccrual
expenditures for community economic development register of deeds modified accrual,acfr:ExpendituresForCommunityEconomicDevelopmentRegisterOfDeedsModifiedAccrual
expenditures for community economic development surveyor modified accrual,acfr:ExpendituresForCommunityEconomicDevelopmentSurveyorModifiedAccrual
expenditures for community economic development zoning modified accrual,acfr:ExpendituresForCommunityEconomicDevelopmentZoningModifiedAccrual
expenditures for community promotion modified accrual,acfr:ExpendituresForCommunityPromotionModifiedAccrual
expenditures for community services modified accrual,acfr:ExpendituresForCommunityServicesModifiedAccrual
expenditures for conservation recreation parks and cultural services modified accrual,acfr:ExpendituresForConservationRecreationParksAndCulturalServicesModifiedAccrual
expenditures for conservation services modified accrual,acfr:ExpendituresForConservationServicesModifiedAccrual
expenditures for contingency services modified accrual,acfr:ExpendituresForContingencyServicesModifiedAccrual
expenditures for contributions to other governments modified accrual,acfr:ExpendituresForContributionsToOtherGovernmentsModifiedAccrual
expenditures for convention center services modified accrual,acfr:ExpendituresForConventionCenterServicesModifiedAccrual
expenditures for corrections training modified accrual,acfr:ExpendituresForCorrectionsTrainingModifiedAccrual
expenditures for crime control and investigation modified accrual,acfr:ExpendituresForCrimeControlAndInvestigationModifiedAccrual
expenditures for department of human services social services board and medical care facility modified accrual,acfr:ExpendituresForDepartmentOfHumanServicesSocialServicesBoardAndMedicalCareFacilityModifiedAccrual
expenditures for economic development home demolition and renovation blight removal modified accrual,acfr:ExpendituresForEconomicDevelopmentHomeDemolitionAndRenovationBlightRemovalModifiedAccrual
expenditures for economic development services modified accrual,acfr:ExpendituresForEconomicDevelopmentServicesModifiedAccrual
expenditures for education services modified accrual,acfr:ExpendituresForEducationServicesModifiedAccrual
expenditures for electricity and power services modified accrual,acfr:ExpendituresForElectricityAndPowerServicesModifiedAccrual
expenditures for facilities maintenance modified accrual,acfr:ExpendituresForFacilitiesMaintenanceModifiedAccrual
expenditures for financial and tax administration accounting department modified accrual,acfr:ExpendituresForFinancialAndTaxAdministrationAccountingDepartmentModifiedAccrual
expenditures for financial and tax administration board of review modified accrual,acfr:ExpendituresForFinancialAndTaxAdministrationBoardOfReviewModifiedAccrual
expenditures for financial and tax administration budget department director modified accrual,acfr:ExpendituresForFinancialAndTaxAdministrationBudgetDepartmentDirectorModifiedAccrual
expenditures for financial and tax administration county survey and remonumentation modified accrual,acfr:ExpendituresForFinancialAndTaxAdministrationCountySurveyAndRemonumentationModifiedAccrual
expenditures for financial and tax administration delinquent tax property sales modified accrual,acfr:ExpendituresForFinancialAndTaxAdministrationDelinquentTaxPropertySalesModifiedAccrual
expenditures for financial and tax administration information technology modified accrual,acfr:ExpendituresForFinancialAndTaxAdministrationInformationTechnologyModifiedAccrual
expenditures for financial and tax administration internal audit external audit board of auditors modified accrual,acfr:ExpendituresForFinancialAndTaxAdministrationInternalAuditExternalAuditBoardOfAuditorsModifiedAccrual
expenditures for financial and tax administration property description modified accrual,acfr:ExpendituresForFinancialAndTaxAdministrationPropertyDescriptionModifiedAccrual
expenditures for financial and tax administration purchasing modified accrual,acfr:ExpendituresForFinancialAndTaxAdministrationPurchasingModifiedAccrual
expenditures for fire department administration modified accrual,acfr:ExpendituresForFireDepartmentAdministrationModifiedAccrual
expenditures for fire department communication modified accrual,acfr:ExpendituresForFireDepartmentCommunicationModifiedAccrual
expenditures for fire department fire fighting modified accrual,acfr:ExpendituresForFireDepartmentFireFightingModifiedAccrual
expenditures for fire department fire prevention modified accrual,acfr:ExpendituresForFireDepartmentFirePreventionModifiedAccrual
expenditures for fire department modified accrual,acfr:ExpendituresForFireDepartmentModifiedAccrual
expenditures for fire department training modified accrual,acfr:ExpendituresForFireDepartmentTrainingModifiedAccrual
expenditures for garage services modified accrual,acfr:ExpendituresForGarageServicesModifiedAccrual
expenditures for general government services administration modified accrual,acfr:ExpendituresForGeneralGovernmentServicesAdministrationModifiedAccrual
expenditures for general government services all others modified accrual,acfr:ExpendituresForGeneralGovernmentServicesAllOthersModifiedAccrual
expenditures for general government services assessing equalization modified accrual,acfr:ExpendituresForGeneralGovernmentServicesAssessingEqualizationModifiedAccrual
expenditures for general government services chief executive modified accrual,acfr:ExpendituresForGeneralGovernmentServicesChiefExecutiveModifiedAccrual
expenditures for general government services finance and tax administration modified accrual,acfr:ExpendituresForGeneralGovernmentServicesFinanceAndTaxAdministrationModifiedAccrual
